{
  "narrative": "The fraud detection literature in this wiki spans two decades of evolution from rule-based systems and statistical outlier detection toward graph-aware deep learning. Early work established the foundational insight that fraud is fundamentally a relational problem: fraudsters coordinate across accounts, devices, and merchants in ways that are detectable only when transactions are viewed as a network rather than independent events. The entries here trace this arc from velocity-feature logistic regression through random forests to heterogeneous GNNs, with growing attention to temporal dynamics and the challenge of operating under severe class imbalance.",
  "subgroups": "**Graph-based methods** — Entries in this group treat the payment network as a first-class object. They use GNN architectures (GraphSAGE, GAT, HGT) on bipartite or heterogeneous graphs and are primarily concerned with ring-detection and account-level risk scoring. Key tensions: scalability vs. expressiveness, batch vs. real-time inference.\n\n**Tabular and statistical methods** — These entries focus on feature engineering (velocity, behavioral biometrics, device fingerprinting) and classical models (logistic regression, XGBoost, isolation forest). They prioritize latency, interpretability, and regulatory compatibility over recall on complex fraud patterns.\n\n**Benchmark and evaluation** — A smaller cluster addresses methodology: dataset construction, evaluation metrics under class imbalance, and the problem of label noise from chargeback disputes.",
  "tensions": "The central tension is **recall vs. latency**: graph models achieve higher recall on coordinated fraud but require expensive graph materialization, while tabular models score in microseconds but miss relational patterns. A related tension is **explainability vs. performance**: regulators increasingly require adverse-action explanations (GDPR Art. 22, US FCRA), which favors linear models despite their lower ceiling. Finally, there is tension around **label quality**: chargebacks are a noisy proxy for fraud, and studies disagree on whether semi-supervised or positive-unlabeled learning meaningfully improves over supervised baselines trained on chargeback labels.",
  "evolution": "The trajectory moves from hand-crafted rules (pre-2005) through statistical scoring (2005–2015) to ensemble methods (2015–2019) and graph-aware deep learning (2019–present). Recent entries show growing interest in self-supervised pre-training on unlabeled transaction graphs to reduce dependence on scarce fraud labels, and in federated learning across card networks to enable cross-institution model sharing without raw data exchange."
}
